{
  "schema_version": 1,
  "protocol": "HELIX_WORK_TOPOLOGY_V1",
  "workflow": "HELIX_LOUIS_WORKFLOW_V1",
  "authority": "NONE",
  "automatic_preemption": false,
  "surface_model": {
    "portfolio_control_plane": "repo-cp",
    "primary_work_surface": "repo-cp",
    "bounded_agent_work_surface_pattern": "*-cp",
    "authority_source": "EXPLICIT_WORK_ENTRY",
    "evidence_return": "repo-cp",
    "supporting_projects": [
      "helix-offload",
      "helix-repo-manager-bot",
      "ws-code-agent",
      "ws-doc-writer"
    ],
    "supporting_projects_are_control_planes": false
  },
  "updated_by_work_entry": "013",
  "future_work_candidates": [
    {
      "id": "remediation.hardening-correctness",
      "kind": "FUTURE_WORK_CANDIDATE_GROUP",
      "execution_authorized": false,
      "members": [
        {
          "id": "R4",
          "status": "PRESERVED",
          "summary": "Hash-locked dependency resolution and explicit supported-Python testing remain unresolved."
        },
        {
          "id": "R5",
          "status": "PRESERVED",
          "summary": "Concrete current correctness finding: valid dotted Git branch names are rejected."
        }
      ],
      "provenance": [
        "docs/handoffs/repo-cp-audit-remediation-20260923.md",
        "Louis + ChatGPT Work Entry 003 remediation disposition"
      ]
    },
    {
      "id": "remediation.diagnostics-state-fidelity",
      "kind": "FUTURE_WORK_CANDIDATE_GROUP",
      "execution_authorized": false,
      "members": [
        {
          "id": "R6",
          "status": "PRESERVED",
          "summary": "Version-source ownership and remaining compound diagnostic distinctions remain unresolved."
        },
        {
          "id": "R9",
          "status": "PRESERVED",
          "summary": "Checkout absence remains insufficiently distinguished from inaccessible, unsafe or corrupt state."
        }
      ],
      "provenance": [
        "docs/handoffs/repo-cp-audit-remediation-20260923.md",
        "Louis + ChatGPT Work Entry 003 remediation disposition"
      ]
    },
    {
      "id": "remediation.evidence-trust-architecture",
      "kind": "FUTURE_WORK_CANDIDATE_GROUP",
      "execution_authorized": false,
      "members": [
        {
          "id": "R7",
          "status": "PRESERVED",
          "summary": "No trusted offline supplied-evidence interface exists for RC009 freshness."
        },
        {
          "id": "R8",
          "status": "PRESERVED",
          "summary": "No bounded declarative cross-pin registry or selector model exists."
        }
      ],
      "provenance": [
        "docs/handoffs/repo-cp-audit-remediation-20260923.md",
        "Louis + ChatGPT Work Entry 003 remediation disposition"
      ]
    },
    {
      "id": "helix-offload.security-durability-reusability",
      "kind": "FUTURE_WORK_CANDIDATE_GROUP",
      "execution_authorized": false,
      "members": [
        {
          "id": "durable-submission-capture-phases",
          "status": "PRESERVED",
          "summary": "Published in canonical helix-offload 3f99e0fda9a84b99b52019cf463a061da906215a: append-only submission/capture phases and read-only crash reconciliation now extend the one-use reservation boundary."
        },
        {
          "id": "private-recovery-storage",
          "status": "PRESERVED",
          "summary": "Published and deployed in the bounded 2026-10-03 slice: protected evidence was copied, hash/permission/restore verified into configured persistent local private storage outside repositories and disposable checkouts; the legacy source remains retained and no independent backup is claimed."
        },
        {
          "id": "allowlisted-public-evidence-derivatives",
          "status": "PRESERVED",
          "summary": "Priority 3: generate narrowly allowlisted public derivatives from retained private originals without treating sanitization as proof of confidentiality."
        },
        {
          "id": "connector-accounting-parity",
          "status": "PRESERVED",
          "summary": "Priority 4: apply truthful submission, response, inference and parsing accounting consistently to OpenAI and OpenClaw connectors."
        },
        {
          "id": "protected-openclaw-prompt-transport",
          "status": "PRESERVED",
          "summary": "Priority 5: replace OpenClaw process-argument prompt transport when a supported protected interface is established."
        },
        {
          "id": "preventive-resource-controls",
          "status": "PRESERVED",
          "summary": "Priority 6: distinguish and implement supported preventive resource controls without mislabeling retrospective usage checks as caps."
        },
        {
          "id": "prompt-authority-and-token-accounting",
          "status": "PRESERVED",
          "summary": "Priority 7, separately handed off for research: separate historical authority facts, current host authority and untrusted model data, and establish evidence-based input-token accounting without changing the preserved attempt."
        },
        {
          "id": "standalone-release-adoption",
          "status": "PRESERVED",
          "summary": "Priority 8: resolve licensing, packaging, versioning, release verification and standalone consumer adoption before external distribution."
        }
      ],
      "provenance": [
        "research-notes/2026-10-03-helix-offload-security-safety-durability-reusability-review.md at commit 4eae1b63e85cdfe42ff64a4ab149e2661ab86150",
        "research-notes/2026-10-03-helix-offload-security-safety-durability-reusability-review-disposition.md",
        "docs/handoffs/WORK_ENTRY_013_SECURITY_REVIEW_AND_GRANT_RESERVATION_20261003.md",
        "Louis's 2026-10-03 instruction preserved these candidates without authorizing implementation or assigning Work Entry numbers",
        "Louis's later 2026-10-03 instruction authorized and completed only the durable-submission-capture-phases and private-recovery-storage members without allocating a new Work Entry number.",
        "docs/handoffs/WORK_ENTRY_013_DURABLE_RECOVERY_20261003.md",
        "docs/handoffs/WORK_ENTRY_013_CLAUDE_FAILURE_RESEARCH_HANDOFF_20261003.md"
      ]
    }
  ],
  "entries": [
    {
      "id": "001",
      "state": "COMPLETE",
      "priority": "GREEN",
      "scheduling_eligibility": "INELIGIBLE_STATE",
      "dependencies": [],
      "summary": "Historical Work Entry 001; its objective is not restated by the Work Entry 003 finding.",
      "provenance": [
        "Louis's Work Entry 003 topology instruction"
      ]
    },
    {
      "id": "002",
      "state": "COMPLETE",
      "priority": "GREEN",
      "scheduling_eligibility": "INELIGIBLE_STATE",
      "dependencies": [],
      "summary": "Standard 002 repository work protocol and Clean Execution Baseline.",
      "provenance": [
        "docs/handoffs/WORK_ENTRY_STANDARD_002.md",
        "canonical commit 456c9bc7b2b2372c96b503c73ab2780961bb340f"
      ]
    },
    {
      "id": "003",
      "state": "COMPLETE",
      "priority": "GREEN",
      "scheduling_eligibility": "INELIGIBLE_STATE",
      "dependencies": [],
      "summary": "Human-led review, reconciliation, publication and canonical-main verification completed.",
      "provenance": [
        "docs/handoffs/WORK_ENTRY_003.md",
        "canonical implementation commit 27ac0626d151c5a8dea5cb4198ce728413feea2d"
      ]
    },
    {
      "id": "004",
      "state": "PARKED",
      "priority": "YELLOW",
      "scheduling_eligibility": "INELIGIBLE_STATE",
      "dependencies": [],
      "summary": "Publication and evidence infrastructure.",
      "provenance": [
        "Work Entry 003 finding; execution not authorized"
      ]
    },
    {
      "id": "005",
      "state": "COMPLETE",
      "priority": "GREEN",
      "scheduling_eligibility": "INELIGIBLE_STATE",
      "dependencies": [],
      "summary": "Execution Admission V1 was implemented, validated and published to canonical helix-offload main; it is a deterministic admission boundary and does not implement model/runtime execution.",
      "provenance": [
        "Work Entry 003 originally identified Work Entry 005 around deterministic repository measurement and evidence concerns; docs/handoffs/WORK_ENTRY_003.md remains the historical evidence.",
        "Operator 005/008 topology correction refined that future-work concern into Work Entry 005 for the helix-offload execution plane and Work Entry 008 for the helix-repo-manager-bot repository intelligence/evidence plane.",
        "Louis's 2026-10-01 reconciliation instruction authorized review and ordinary canonical-main publication of the preserved Execution Admission V1 candidate.",
        "Canonical helix-offload implementation commit 3073fd4e4c552a692d506489597faaf3f5e1038a was independently verified after publication.",
        "The implementation performs deterministic admission only; no model runner, workload execution, deployment, credential, account, workstation or peer mutation was authorized or performed.",
        "5070 Ti remains candidate compute only, not required hardware, an accepted deployment target, an exclusive host, an ownership boundary or a production runtime.",
        "Logical ownership, execution placement and physical hosting are separate decisions; the Work Entry 005 relationship with Work Entry 008 is intentionally unresolved."
      ]
    },
    {
      "id": "006",
      "state": "COMPLETE",
      "priority": "GREEN",
      "scheduling_eligibility": "INELIGIBLE_STATE",
      "dependencies": [
        "003"
      ],
      "summary": "Usage telemetry research, bounded deterministic-adviser implementation, publication and canonical verification completed.",
      "provenance": [
        "Work Entry 006 blocked result: priority preemption did not override unpublished Work Entry 003 dependencies",
        "Louis's Work Entry 003 resume instruction",